title,price,rating,reviews,availability
PlayStation®4 Console – Call of Duty® Modern Warfare II Bundle,Price information not available,4.4,81,In Stock
"Wireless Controller Dual Vibration Game Joystick Controller for Ps4 Controller/Slim/Pro,Compatible with PS4 Console",Price information not available,4.1,"1,941",In Stock
"FASIGO PS4 Controller 2 Pack, Wireless PS4 Controller for PS4 / Pro/Slim & PC, with 2 USB C Cable - Black",Price information not available,4.2,28,In Stock
DualShock 4 Wireless Controller for PlayStation 4 - Glacier White,Price information not available,4.6,"168,067",
"PS4 Controller Wireless, with USB C Cable/1000mAh Battery/Dual Motors/6-Axis Gyro/3.5mm Audio Jack/Multi Touch Pad/Share Button, PS4 Controller Compatible with PS4/Slim/Pro/PC",Price information not available,4.2,"2,899",In Stock
"Wireless Controller for PS4 with 2 Thumb Grips, 3.5mm Audio and Turbo Function, Purple Galaxy Custom Design V2 Gamepad Joysticks for PS4, Compatible with PS4, Slim, Pro and Windows PC",Price information not available,4.2,"2,440",In Stock
Mortal Kombat XL (PS4),Price information not available,4.7,"2,907",In Stock
"OIVO PS4 Stand Cooling Fan Station for Playstation 4/PS4 Slim/PS4 Pro, PS4 Pro Vertical Stand with Dual Controller EXT Port Charger Dock Station and 12 Game Slots",Price information not available,4.5,"45,602",In Stock
Minecraft Starter Collection (PS4),Price information not available,4.6,760,Only 10 left in stock - order soon.
"KDYGPDCT 2 Pack Wireless Controller for PS4,Dual-shock 4 Controller with 6-Axis Motion Sensor, Sensitive Touch Pad, Built-in Speaker & Headphone Jack, Compatible with PlayStation 4/Pro/Slim/PC",Price information not available,4.5,41,In Stock
PS4 Media Remote Control for Playstation 4 Console - PS4 Remote with Bluetooth Enabled - PS4 Accessories,Price information not available,3.9,71,In Stock
Sony Playstation PS4 1TB Black Console,Price information not available,4.6,"1,501",In Stock
PlayStation 4 Slim 1TB Console,Price information not available,4.7,"15,721",Only 1 left in stock - order soon.
Sony PlayStation 4 Slim Limited Edition 1TB Gaming Console (Renewed),Price information not available,4.3,"1,434",Only 2 left in stock - order soon.
PlayStation 4 500GB Console [Old Model][Discontinued],Price information not available,4.5,"13,592",Only 1 left in stock - order soon.
Sony PlayStation 4 Pro 1TB Console - Black (PS4 Pro),Price information not available,4.4,"4,136",Only 1 left in stock - order soon.
"Turtle Beach Atlas Air Wireless Open Back PC Gaming Headset for PC, PS5, PS4, Nintendo Switch, Mobile - 24-bit High-Fidelity Audio, Broadcast Grade Mic, Bluetooth, Floating Memory Foam Earcup - Black",Price information not available,4.2,78,In Stock
